product_id,title,product_description,rating,ratings_count,initial_price,discount,final_price,currency,images,delivery_options,product_details,breadcrumbs,product_specifications,amount_of_stars,what_customers_said,seller_name,sizes,videos,seller_information,variations,best_offer,more_offers,category
18532334,Pepe Jeans,Men Green Printed Cotton Basic Briefs,0.0,0,459.0,20.0,"""₹298.00""",INR,"http://assets.myntassets.com/assets/images/18532334/2022/6/1/9fa5a810-d7a7-4e3d-9ee4-5f9358949c311654079953571PepeJeansMenGreenPrintedCottonBasicBriefs1.jpg,http://assets.myntassets.com/assets/images/18532334/2022/6/1/0e391503-2bfe-48ab-bc9d-4c30e85e5ba21654079953582PepeJeansMenGreenPrintedCottonBasicBriefs2.jpg,http://assets.myntassets.com/assets/images/18532334/2022/6/1/8e752a49-a8fc-43f7-baaa-60df9d44d0871654079953524PepeJeansMenGreenPrintedCottonBasicBriefs3.jpg,http://assets.myntassets.com/assets/images/18532334/2022/6/1/aaaf3f7b-d182-43e5-866f-488aca73b7231654079953548PepeJeansMenGreenPrintedCottonBasicBriefs4.jpg,http://assets.myntassets.com/assets/images/18532334/2022/6/1/fda9cc1d-6f86-4084-887b-6fe90eef3ce21654079953560PepeJeansMenGreenPrintedCottonBasicBriefs5.jpg,http://assets.myntassets.com/assets/images/18532334/2022/6/1/7351acf1-e339-46c3-b406-c734166ce6ef1654079953536PepeJeansMenGreenPrintedCottonBasicBriefs6.jpg","[""100% Original Products"",""Pay on delivery might be available"",""Items like innerwear, socks, certain accessories and some high-value fragile items do not come under our return policy""]","{""description"":""Made of ultra-soft premium enriched egyptian cotton, Soft, double-layred pouch lends you additional support. Smooth and durable waistband provides comfortable grip. Soft breezy rib fabric promises maximum breathability, Enjoy label -free comfort all day long. This product is treated with ultra fresh a technology that restricts microbial growth keeps the fabric hygienic and fresh for long hours and your innewear completely odour -free.Key Feature:Intellifresh Technology: Ultra soft combed cotton, makes you feel cool and comfortable all day. Fabric covered leg elastic gives full hip coverage and perfect fit around the leg. Contrast piping for stylish look.Elastic Wasitband: Nylon stretch jacquard waistband is soothing to the skin. The waistband is made from high-quality elastic which can stretch upto 6 inches to ensure maximum flexibility and lasts really long.100% Cotton: These brief innerwear are made from 100% Natural Cotton grown in India. No harmful colours or chemicals are used in the making of this product, to ensure that there is no skin irritation to the user.The fabrics are pre-tested and pre-washed to ensure highest quality is maintained and that the color does not run.Relaxed Fit: A relaxed fit makes these shorts the perfect sleepwear companion. Ideal to just lounge at home, Enjoy label-free comfort all day long.Wash Care: These boxer shorts are very easy to take care of. A regular cold machine wash and dry in shade is recommended. Do not use bleach or any coloring agents."",""material_and_care"":""Cotton. Wash at 40C. Do not bleach. Tumble Dry, Low temperature. Iron Stream or  dry with low heat. Do not dry clean""}","[{""name"":""Clothing"",""url"":""https://www.myntra.com/clothing""},{""name"":""Men"",""url"":""https://www.myntra.com/men-clothing""},{""name"":""Briefs"",""url"":""https://www.myntra.com/briefs""},{""name"":""Pepe Jeans"",""url"":""https://www.myntra.com/pepe-jeans-briefs""},{""name"":""More by Pepe Jeans"",""url"":""https://www.myntra.com/pepe-jeans""}]","[{""specification_name"":""Assorted"",""specification_value"":""No""},{""specification_name"":""Character"",""specification_value"":""NA""},{""specification_name"":""Fabric"",""specification_value"":""Cotton""},{""specification_name"":""Fabric 2"",""specification_value"":""NA""},{""specification_name"":""Features"",""specification_value"":""Anti Microbial""},{""specification_name"":""Knit or Woven"",""specification_value"":""Knitted""},{""specification_name"":""Multipack Set"",""specification_value"":""NA""},{""specification_name"":""Pattern"",""specification_value"":""Printed""},{""specification_name"":""Print or Pattern Type"",""specification_value"":""Self Design""},{""specification_name"":""Style"",""specification_value"":""NA""},{""specification_name"":""Sustainable"",""specification_value"":""Regular""},{""specification_name"":""Type"",""specification_value"":""Basic""},{""specification_name"":""Waist Rise"",""specification_value"":""Low-Rise""},{""specification_name"":""Waistband"",""specification_value"":""Outer Elastic""},{""specification_name"":""Wash Care"",""specification_value"":""Machine Wash""}]","{""1_star"":0,""2_stars"":0,""3_stars"":0,""4_stars"":0,""5_stars"":0}",,Vis███ St███,"[{""size"":""S"",""value"":""30.0in"",""value_name"":""To Fit Waist""},{""size"":""M"",""value"":""34.0in"",""value_name"":""To Fit Waist""},{""size"":""L"",""value"":""38.0in"",""value_name"":""To Fit Waist""},{""size"":""XL"",""value"":""42.0in"",""value_name"":""To Fit Waist""}]",,3rd███oor███o. █████████Mai█████████████████████out███████████████████████████████████████████████████████████████████████████,"[{},{},{},{},{},{},{},{},{},{},{}]","{""applicable_on"":""Orders above Rs. 649 (only on first purchase)"",""best_price"":""206"",""coupon_code"":""MYNTRA200"",""coupon_discount"":"" Rs. 92.0 off (check cart for final savings)""}","[{""offer_name"":""10% Instant Discount on IndusInd Bank Debit Cards "",""offer_value"":"" Min Spend ₹2,500; Max Discount ₹1,000. ""},{""offer_name"":""10% Instant Discount on Citi Credit & Debit Cards "",""offer_value"":"" Min Spend ₹3,000; Max Discount ₹1,000. ""},{""offer_name"":""10% Instant Discount on Yes Bank Credit Cards "",""offer_value"":"" Min Spend ₹3,500; Max Discount ₹1,000. ""},{""offer_name"":""Flat ₹100 Cashback on Mobiwkik Wallet/Zip "",""offer_value"":"" Min Spend ₹1,999. ""},{""offer_name"":""7.5% Discount on Myntra Kotak Credit Card."",""offer_value"":"" Max Discount Up to ₹750 on every spends. ""}]",briefs
16696094,Van Heusen,Men Swift Dry High Stretch Mesh AIR Series Active Briefs 8905325842743,4.6,192,649.0,,"""₹649.00""",INR,"http://assets.myntassets.com/assets/images/16696094/2022/3/19/fdc22887-c648-4b01-8273-8764f57198b01647679232538-Van-Heusen-Men-Black-Solid-Breathable-Briefs-8905325842743-1-1.jpg,http://assets.myntassets.com/assets/images/16696094/2022/3/19/0ddbd926-16cb-4a5f-af18-2885c6b49a171647679232529-Van-Heusen-Men-Black-Solid-Breathable-Briefs-8905325842743-1-2.jpg,http://assets.myntassets.com/assets/images/16696094/2022/3/19/907be1a3-1790-48e5-ab55-a327a7fbd02c1647679232520-Van-Heusen-Men-Black-Solid-Breathable-Briefs-8905325842743-1-3.jpg,http://assets.myntassets.com/assets/images/16696094/2022/3/19/b9c8afb6-6e3d-45a0-8e54-4b9717ec966f1647679232493-Van-Heusen-Men-Black-Solid-Breathable-Briefs-8905325842743-1-4.jpg,http://assets.myntassets.com/assets/images/16696094/2023/8/25/d722af9b-2cf2-47ed-9a9a-a8ac2ce08c6b1692952116809-Van-Heusen-Men-Swift-Dry-High-Stretch-Mesh-AIR-Series-Active-5.jpg,http://assets.myntassets.com/assets/images/16696094/2023/2/17/43ecdde0-b45c-44dc-bd0f-435e1dcf03fe1676616830426-Van-Heusen-Men-Swift-Dry-High-Stretch-Mesh-Breathable-AIR-Ac-11.jpg","[""100% Original Products"",""Pay on delivery might be available"",""Items like innerwear, socks, certain accessories and some high-value fragile items do not come under our return policy""]","{""description"":""Black solid mid-rise briefs, has an outer elasticated waistband and a double layered contoured pouchAIR: Van Heusen AIR brief is made with innovative, breathable, ultra soft fabric equipped with Swift Dry technology which is super soft on your skin while also drawing perspiration from it and keeping it cool and dry.Swift Dry: Swift Dry Technology draws perspiration from the skin; keeping the body cool, dry and comfortable. Especially made for active-wear use.Ultra Light Mesh Fabric With High Stretch: Easy to flex, the stretchable fabric construction enhances comfort and flexibility and allows ease in movement.Sweat Free and Active: Stay Sweat Free and Active all day, thanks to the fabrics.Label Free Comfort: The label free design ensures you stay at ease without any skin irritation for hours.85% Polyamide, 15% Elastane: An optimum amount of stretch allows ease in movement and comfort to the wearer."",""material_and_care"":""85% polyamide, 15% elastane. Machine wash cold"",""size_and_fit"":""The model (height 6') is wearing size M""}","[{""name"":""Clothing"",""url"":""https://www.myntra.com/clothing""},{""name"":""Men"",""url"":""https://www.myntra.com/men-clothing""},{""name"":""Briefs"",""url"":""https://www.myntra.com/briefs""},{""name"":""Van Heusen"",""url"":""https://www.myntra.com/van-heusen-briefs""},{""name"":""More by Van Heusen"",""url"":""https://www.myntra.com/van-heusen""}]","[{""specification_name"":""Assorted"",""specification_value"":""No""},{""specification_name"":""Character"",""specification_value"":""NA""},{""specification_name"":""Fabric"",""specification_value"":""Polyamide""},{""specification_name"":""Fabric 2"",""specification_value"":""Elastane""},{""specification_name"":""Features"",""specification_value"":""NA""},{""specification_name"":""Knit or Woven"",""specification_value"":""Knitted""},{""specification_name"":""Multipack Set"",""specification_value"":""NA""},{""specification_name"":""Number of Items"",""specification_value"":""1""},{""specification_name"":""Pattern"",""specification_value"":""Solid""},{""specification_name"":""Print or Pattern Type"",""specification_value"":""Solid""},{""specification_name"":""Style"",""specification_value"":""NA""},{""specification_name"":""Sustainable"",""specification_value"":""Regular""},{""specification_name"":""Type"",""specification_value"":""Basic""},{""specification_name"":""Waist Rise"",""specification_value"":""Mid-Rise""},{""specification_name"":""Waistband"",""specification_value"":""Outer Elastic""},{""specification_name"":""Wash Care"",""specification_value"":""Machine Wash""}]","{""1_star"":8,""2_stars"":0,""3_stars"":4,""4_stars"":31,""5_stars"":149}","[{""percentage"":""100"",""value_name"":""Fit, Just Right""}]",Wes███ry ███din█████████d_M██████,"[{""size"":""S"",""value"":""28.0in"",""value_name"":""To Fit Waist""},{""size"":""M"",""value"":""32.0in"",""value_name"":""To Fit Waist""},{""size"":""L"",""value"":""36.0in"",""value_name"":""To Fit Waist""},{""size"":""XL"",""value"":""40.0in"",""value_name"":""To Fit Waist""}]",,"Gro███ Fl███, N█████████old█████████████████████rd ███████████████████████████████████████████████████","[{},{},{},{}]","{""applicable_on"":""Orders above Rs. 649 (only on first purchase)"",""best_price"":""449"",""coupon_code"":""MYNTRA200"",""coupon_discount"":"" Rs. 200.0 off (check cart for final savings)""}","[{""offer_name"":""10% Instant Discount on IndusInd Bank Debit Cards "",""offer_value"":"" Min Spend ₹2,500; Max Discount ₹1,000. ""},{""offer_name"":""10% Instant Discount on Citi Credit & Debit Cards "",""offer_value"":"" Min Spend ₹3,000; Max Discount ₹1,000. ""},{""offer_name"":""10% Instant Discount on Yes Bank Credit Cards "",""offer_value"":"" Min Spend ₹3,500; Max Discount ₹1,000. ""},{""offer_name"":""Flat ₹100 Cashback on Mobiwkik Wallet/Zip "",""offer_value"":"" Min Spend ₹1,999. ""},{""offer_name"":""7.5% Discount on Myntra Kotak Credit Card."",""offer_value"":"" Max Discount Up to ₹750 on every spends. ""}]",briefs
21867416,DressBerry,Women Boy Shorts Brief,4.1,14,299.0,28.0,"""₹215.00""",INR,"http://assets.myntassets.com/assets/images/21867416/2023/2/6/17cf8e77-2baf-4c0f-97b3-868e2a5edef81675691569626DressberryWomensSolidMidRiseBoyShortBrief1.jpg,http://assets.myntassets.com/assets/images/21867416/2023/2/6/d50f558b-078f-40fc-87b0-d5345578f2931675691569575DressberryWomensSolidMidRiseBoyShortBrief2.jpg,http://assets.myntassets.com/assets/images/21867416/2023/2/6/cf31116c-301f-4576-ad34-b3db937dd2201675691569594DressberryWomensSolidMidRiseBoyShortBrief3.jpg,http://assets.myntassets.com/assets/images/21867416/2023/2/6/658254d4-d5d4-4aff-afb7-f604703071f61675691569610DressberryWomensSolidMidRiseBoyShortBrief4.jpg,http://assets.myntassets.com/assets/images/21867416/2023/2/6/c6ec1c07-3223-42a0-8960-774eaaaccf291675691569643DressberryWomensSolidMidRiseBoyShortBrief5.jpg","[""100% Original Products"",""Pay on delivery might be available"",""Items like innerwear, socks, certain accessories and some high-value fragile items do not come under our return policy""]","{""description"":""Peach-coloured solid boy shorts briefs, has an elasticated waistband with double layered gussetVANumber: DB-JOY-PCH-1Type: Boy shortsMid RiseWaist band :Inner Elastic"",""material_and_care"":""95% Cotton and 5% Spandex. Hand wash""}","[{""name"":""Clothing"",""url"":""https://www.myntra.com/clothing""},{""name"":""Women"",""url"":""https://www.myntra.com/women-clothing""},{""name"":""Briefs"",""url"":""https://www.myntra.com/briefs""},{""name"":""DressBerry"",""url"":""https://www.myntra.com/dressberry-briefs""},{""name"":""More by DressBerry"",""url"":""https://www.myntra.com/dressberry""}]","[{""specification_name"":""Assorted"",""specification_value"":""No""},{""specification_name"":""Character"",""specification_value"":""NA""},{""specification_name"":""Fabric"",""specification_value"":""Cotton""},{""specification_name"":""Fabric 2"",""specification_value"":""NA""},{""specification_name"":""Features"",""specification_value"":""NA""},{""specification_name"":""Knit or Woven"",""specification_value"":""Knitted""},{""specification_name"":""Multipack Set"",""specification_value"":""Single""},{""specification_name"":""Pattern"",""specification_value"":""Solid""},{""specification_name"":""Print or Pattern Type"",""specification_value"":""Solid""},{""specification_name"":""Style"",""specification_value"":""NA""},{""specification_name"":""Sustainable"",""specification_value"":""Regular""},{""specification_name"":""Type"",""specification_value"":""Boy Shorts""},{""specification_name"":""Waist Rise"",""specification_value"":""Mid-Rise""},{""specification_name"":""Waistband"",""specification_value"":""Inner Elastic""},{""specification_name"":""Wash Care"",""specification_value"":""Machine Wash""}]","{""1_star"":2,""2_stars"":0,""3_stars"":1,""4_stars"":2,""5_stars"":9}",,VAC███CRE███ONS███,"[{""size"":""S"",""value"":""30.0in"",""value_name"":""To Fit Waist""},{""size"":""M"",""value"":""32.0in"",""value_name"":""To Fit Waist""},{""size"":""L"",""value"":""34.0in"",""value_name"":""To Fit Waist""},{""size"":""XL"",""value"":""36.0in"",""value_name"":""To Fit Waist""}]",,"870███TRE███SHE█████████, B█████████████████████hi ██████████████████","[{},{},{},{}]","{""applicable_on"":""Orders above Rs. 449 (only on first purchase)"",""best_price"":""143"",""coupon_code"":""TOPBRANDOFFER"",""coupon_discount"":"" Rs. 72.0 off (check cart for final savings)""}","[{""offer_name"":""10% Instant Discount on IndusInd Bank Debit Cards "",""offer_value"":"" Min Spend ₹2,500; Max Discount ₹1,000. ""},{""offer_name"":""10% Instant Discount on Citi Credit & Debit Cards "",""offer_value"":"" Min Spend ₹3,000; Max Discount ₹1,000. ""},{""offer_name"":""10% Instant Discount on Yes Bank Credit Cards "",""offer_value"":"" Min Spend ₹3,500; Max Discount ₹1,000. ""},{""offer_name"":""Flat ₹100 Cashback on Mobiwkik Wallet/Zip "",""offer_value"":"" Min Spend ₹1,999. ""},{""offer_name"":""7.5% Discount on Myntra Kotak Credit Card."",""offer_value"":"" Max Discount Up to ₹750 on every spends. ""}]",briefs
21850852,Soie,Women High Waist Full Coverage Lace Brief,4.9,14,390.0,5.0,"""₹370.00""",INR,"http://assets.myntassets.com/assets/images/21850852/2023/2/4/5ced82e7-afa0-4000-806a-4af4193aa27f1675510055694SOIEHighWaistFullCoverageLaceBrief1.jpg,http://assets.myntassets.com/assets/images/21850852/2023/2/4/c2481789-a1a4-4e39-bb61-f64df6b5fde11675510055682SOIEHighWaistFullCoverageLaceBrief2.jpg,http://assets.myntassets.com/assets/images/21850852/2023/2/4/f0809f1a-2e69-480f-aef4-e469f279c7361675510055707SOIEHighWaistFullCoverageLaceBrief3.jpg,http://assets.myntassets.com/assets/images/21850852/2023/2/4/d0467938-4427-4067-b4c8-be9a611257c91675510055733SOIEHighWaistFullCoverageLaceBrief4.jpg,http://assets.myntassets.com/assets/images/21850852/2023/2/4/5d7e9c66-eeb0-42d1-b6c6-69414fd050ce1675510055719SOIEHighWaistFullCoverageLaceBrief5.jpg","[""100% Original Products"",""Pay on delivery might be available"",""Items like innerwear, socks, certain accessories and some high-value fragile items do not come under our return policy""]","{""description"":""PRODUCT DETAILS : Our most comfortable brief is crafted for both luxury and leisure. With its soft brushed fabric and delicate lace, it offers full coverage and a high waist for an effortless look, making it perfect for work or home. Specially crafted with a superior nylon spandex blend fabric, this brief offers both comfort and style.Features:VAN Number : FP-1706WINE. High waist. Full coverage. Brief style. Soft nylon spandex fabric. Lace detail. Specially brushed fabric"",""material_and_care"":""Nylon and Spandex. Hand Wash""}","[{""name"":""Clothing"",""url"":""https://www.myntra.com/clothing""},{""name"":""Women"",""url"":""https://www.myntra.com/women-clothing""},{""name"":""Briefs"",""url"":""https://www.myntra.com/briefs""},{""name"":""Soie"",""url"":""https://www.myntra.com/soie-briefs""},{""name"":""More by Soie"",""url"":""https://www.myntra.com/soie""}]","[{""specification_name"":""Assorted"",""specification_value"":""No""},{""specification_name"":""Character"",""specification_value"":""NA""},{""specification_name"":""Fabric"",""specification_value"":""Nylon""},{""specification_name"":""Fabric 2"",""specification_value"":""Elastane""},{""specification_name"":""Features"",""specification_value"":""NA""},{""specification_name"":""Knit or Woven"",""specification_value"":""Knitted""},{""specification_name"":""Multipack Set"",""specification_value"":""Single""},{""specification_name"":""Number of Items"",""specification_value"":""1""},{""specification_name"":""Pattern"",""specification_value"":""Solid""},{""specification_name"":""Print or Pattern Type"",""specification_value"":""Floral""},{""specification_name"":""Style"",""specification_value"":""Lace""},{""specification_name"":""Sustainable"",""specification_value"":""Regular""},{""specification_name"":""Type"",""specification_value"":""Hipster""},{""specification_name"":""Waist Rise"",""specification_value"":""High-Rise""},{""specification_name"":""Waistband"",""specification_value"":""Inner Elastic""},{""specification_name"":""Wash Care"",""specification_value"":""Hand Wash""}]","{""1_star"":0,""2_stars"":0,""3_stars"":1,""4_stars"":0,""5_stars"":13}",,GIN███IND███RIE█████████,"[{""size"":""S"",""value"":""26.4in to 28.7in"",""value_name"":""To Fit Waist""},{""size"":""S"",""value"":""32.7in to 35.5in"",""value_name"":""To Fit Hip""},{""size"":""M"",""value"":""28.7in to 31.9in"",""value_name"":""To Fit Waist""},{""size"":""M"",""value"":""35.5in to 38.2in"",""value_name"":""To Fit Hip""},{""size"":""L"",""value"":""31.9in to 34.6in"",""value_name"":""To Fit Waist""},{""size"":""L"",""value"":""38.2in to 40.9in"",""value_name"":""To Fit Hip""},{""size"":""XL"",""value"":""34.6in to 37.8in"",""value_name"":""To Fit Waist""},{""size"":""XL"",""value"":""40.9in to 44.1in"",""value_name"":""To Fit Hip""},{""size"":""XXL"",""value"":""37.8in to 40.6in"",""value_name"":""To Fit Waist""},{""size"":""XXL"",""value"":""44.1in to 46.9in"",""value_name"":""To Fit Hip""}]",,Plo███o B███9-3█████████oor█████████████████████d A██████████████████████████████████████████████████████████████████████████████,[{}],"{""applicable_on"":""Orders above Rs. 649 (only on first purchase)"",""best_price"":""256"",""coupon_code"":""MYNTRA200"",""coupon_discount"":"" Rs. 114.0 off (check cart for final savings)""}","[{""offer_name"":""10% Instant Discount on IndusInd Bank Debit Cards "",""offer_value"":"" Min Spend ₹2,500; Max Discount ₹1,000. ""},{""offer_name"":""10% Instant Discount on Citi Credit & Debit Cards "",""offer_value"":"" Min Spend ₹3,000; Max Discount ₹1,000. ""},{""offer_name"":""10% Instant Discount on Yes Bank Credit Cards "",""offer_value"":"" Min Spend ₹3,500; Max Discount ₹1,000. ""},{""offer_name"":""Flat ₹100 Cashback on Mobiwkik Wallet/Zip "",""offer_value"":"" Min Spend ₹1,999. ""},{""offer_name"":""7.5% Discount on Myntra Kotak Credit Card."",""offer_value"":"" Max Discount Up to ₹750 on every spends. ""}]",briefs
